{
  "device": "Pioneer CDJ-350 CH2",
  "vendor": "unknown",
  "plate": {
    "image": "",
    "width": 0,
    "height": 0
  },
  "layers": [
    "base",
    "shift"
  ],
  "out_of_scope": [
    "mixxx_script_bindings",
    "hid_surfaces",
    "plate_pending"
  ],
  "controls": [
    {
      "id": "pioneer-cdj-350-ch2-jog_wheel",
      "fig": "jog_wheel",
      "label": "jog_wheel",
      "kind": "jog",
      "x": 2.0,
      "y": 4.0,
      "w": 6.0,
      "h": 6.0,
      "layer": "base",
      "section": "deck",
      "midi": {
        "name": "jog_wheel",
        "type": "cc",
        "ch": 1,
        "code": 16,
        "shift_name": null
      },
      "notes": "[jog_wheel] Mixxx ingest - refine coords against plate"
    },
    {
      "id": "pioneer-cdj-350-ch2-loop_double",
      "fig": "loop_double",
      "label": "loop_double",
      "kind": "button",
      "x": 9.8,
      "y": 4.0,
      "w": 4.0,
      "h": 4.5,
      "layer": "base",
      "section": "deck",
      "midi": {
        "name": "loop_double",
        "type": "note",
        "ch": 1,
        "code": 22,
        "shift_name": null
      },
      "notes": "[loop_double] Mixxx ingest - refine coords against plate"
    },
    {
      "id": "pioneer-cdj-350-ch2-loop_halve",
      "fig": "loop_halve",
      "label": "loop_halve",
      "kind": "button",
      "x": 17.6,
      "y": 4.0,
      "w": 4.0,
      "h": 4.5,
      "layer": "base",
      "section": "deck",
      "midi": {
        "name": "loop_halve",
        "type": "note",
        "ch": 1,
        "code": 23,
        "shift_name": null
      },
      "notes": "[loop_halve] Mixxx ingest - refine coords against plate"
    },
    {
      "id": "pioneer-cdj-350-ch2-play",
      "fig": "play",
      "label": "play",
      "kind": "button",
      "x": 25.4,
      "y": 4.0,
      "w": 4.0,
      "h": 4.5,
      "layer": "base",
      "section": "deck",
      "midi": {
        "name": "play",
        "type": "note",
        "ch": 1,
        "code": 0,
        "shift_name": null
      },
      "notes": "[play] Mixxx ingest - refine coords against plate"
    },
    {
      "id": "pioneer-cdj-350-ch2-cue_default",
      "fig": "cue_default",
      "label": "cue_default",
      "kind": "button",
      "x": 33.2,
      "y": 4.0,
      "w": 4.0,
      "h": 4.5,
      "layer": "base",
      "section": "deck",
      "midi": {
        "name": "cue_default",
        "type": "note",
        "ch": 1,
        "code": 1,
        "shift_name": null
      },
      "notes": "[cue_default] Mixxx ingest - refine coords against plate"
    },
    {
      "id": "pioneer-cdj-350-ch2-beatsync",
      "fig": "beatsync",
      "label": "beatsync",
      "kind": "button",
      "x": 41.0,
      "y": 4.0,
      "w": 4.0,
      "h": 4.5,
      "layer": "base",
      "section": "deck",
      "midi": {
        "name": "beatsync",
        "type": "note",
        "ch": 1,
        "code": 38,
        "shift_name": null
      },
      "notes": "[beatsync] Mixxx ingest - refine coords against plate"
    },
    {
      "id": "pioneer-cdj-350-ch2-fwd",
      "fig": "fwd",
      "label": "fwd",
      "kind": "button",
      "x": 48.8,
      "y": 4.0,
      "w": 4.0,
      "h": 4.5,
      "layer": "base",
      "section": "deck",
      "midi": {
        "name": "fwd",
        "type": "note",
        "ch": 1,
        "code": 2,
        "shift_name": null
      },
      "notes": "[fwd] Mixxx ingest - refine coords against plate"
    },
    {
      "id": "pioneer-cdj-350-ch2-back",
      "fig": "back",
      "label": "back",
      "kind": "button",
      "x": 56.6,
      "y": 4.0,
      "w": 4.0,
      "h": 4.5,
      "layer": "base",
      "section": "deck",
      "midi": {
        "name": "back",
        "type": "note",
        "ch": 1,
        "code": 3,
        "shift_name": null
      },
      "notes": "[back] Mixxx ingest - refine coords against plate"
    },
    {
      "id": "pioneer-cdj-350-ch2-end",
      "fig": "end",
      "label": "end",
      "kind": "button",
      "x": 64.4,
      "y": 4.0,
      "w": 4.0,
      "h": 4.5,
      "layer": "base",
      "section": "deck",
      "midi": {
        "name": "end",
        "type": "note",
        "ch": 1,
        "code": 4,
        "shift_name": null
      },
      "notes": "[end] Mixxx ingest - refine coords against plate"
    },
    {
      "id": "pioneer-cdj-350-ch2-start",
      "fig": "start",
      "label": "start",
      "kind": "button",
      "x": 72.2,
      "y": 4.0,
      "w": 4.0,
      "h": 4.5,
      "layer": "base",
      "section": "deck",
      "midi": {
        "name": "start",
        "type": "note",
        "ch": 1,
        "code": 5,
        "shift_name": null
      },
      "notes": "[start] Mixxx ingest - refine coords against plate"
    },
    {
      "id": "pioneer-cdj-350-ch2-loop_in",
      "fig": "loop_in",
      "label": "loop_in",
      "kind": "button",
      "x": 80.0,
      "y": 4.0,
      "w": 4.0,
      "h": 4.5,
      "layer": "base",
      "section": "deck",
      "midi": {
        "name": "loop_in",
        "type": "note",
        "ch": 1,
        "code": 6,
        "shift_name": null
      },
      "notes": "[loop_in] Mixxx ingest - refine coords against plate"
    },
    {
      "id": "pioneer-cdj-350-ch2-loop_out",
      "fig": "loop_out",
      "label": "loop_out",
      "kind": "button",
      "x": 87.8,
      "y": 4.0,
      "w": 4.0,
      "h": 4.5,
      "layer": "base",
      "section": "deck",
      "midi": {
        "name": "loop_out",
        "type": "note",
        "ch": 1,
        "code": 7,
        "shift_name": null
      },
      "notes": "[loop_out] Mixxx ingest - refine coords against plate"
    },
    {
      "id": "pioneer-cdj-350-ch2-rate",
      "fig": "rate",
      "label": "rate",
      "kind": "knob",
      "x": 2.0,
      "y": 10.5,
      "w": 4.0,
      "h": 4.5,
      "layer": "base",
      "section": "deck",
      "midi": {
        "name": "rate",
        "type": "cc",
        "ch": 1,
        "code": 29,
        "shift_name": null
      },
      "notes": "[rate] Mixxx ingest - refine coords against plate"
    },
    {
      "id": "pioneer-cdj-350-ch2-reloop_exit",
      "fig": "reloop_exit",
      "label": "reloop_exit",
      "kind": "button",
      "x": 9.8,
      "y": 10.5,
      "w": 4.0,
      "h": 4.5,
      "layer": "base",
      "section": "deck",
      "midi": {
        "name": "reloop_exit",
        "type": "note",
        "ch": 1,
        "code": 8,
        "shift_name": null
      },
      "notes": "[reloop_exit] Mixxx ingest - refine coords against plate"
    },
    {
      "id": "pioneer-cdj-350-ch2-toggle_playlist",
      "fig": "toggle_playlist",
      "label": "toggle_playlist",
      "kind": "button",
      "x": 17.6,
      "y": 10.5,
      "w": 4.0,
      "h": 4.5,
      "layer": "base",
      "section": "deck",
      "midi": {
        "name": "toggle_playlist",
        "type": "note",
        "ch": 1,
        "code": 46,
        "shift_name": null
      },
      "notes": "[toggle_playlist] Mixxx ingest - refine coords against plate"
    },
    {
      "id": "pioneer-cdj-350-ch2-exit_playlist",
      "fig": "exit_playlist",
      "label": "exit_playlist",
      "kind": "button",
      "x": 25.4,
      "y": 10.5,
      "w": 4.0,
      "h": 4.5,
      "layer": "base",
      "section": "deck",
      "midi": {
        "name": "exit_playlist",
        "type": "note",
        "ch": 1,
        "code": 50,
        "shift_name": null
      },
      "notes": "[exit_playlist] Mixxx ingest - refine coords against plate"
    },
    {
      "id": "pioneer-cdj-350-ch2-select_push",
      "fig": "select_push",
      "label": "select_push",
      "kind": "button",
      "x": 33.2,
      "y": 10.5,
      "w": 4.0,
      "h": 4.5,
      "layer": "base",
      "section": "deck",
      "midi": {
        "name": "select_push",
        "type": "note",
        "ch": 1,
        "code": 51,
        "shift_name": null
      },
      "notes": "[select_push] Mixxx ingest - refine coords against plate"
    },
    {
      "id": "pioneer-cdj-350-ch2-tempo_btn",
      "fig": "tempo_btn",
      "label": "tempo_btn",
      "kind": "fader",
      "x": 41.0,
      "y": 10.5,
      "w": 3.0,
      "h": 8.0,
      "layer": "base",
      "section": "deck",
      "midi": {
        "name": "tempo_btn",
        "type": "note",
        "ch": 1,
        "code": 16,
        "shift_name": null
      },
      "notes": "[tempo_btn] Mixxx ingest - refine coords against plate"
    },
    {
      "id": "pioneer-cdj-350-ch2-keylock",
      "fig": "keylock",
      "label": "keylock",
      "kind": "button",
      "x": 48.8,
      "y": 10.5,
      "w": 4.0,
      "h": 4.5,
      "layer": "base",
      "section": "deck",
      "midi": {
        "name": "keylock",
        "type": "note",
        "ch": 1,
        "code": 17,
        "shift_name": null
      },
      "notes": "[keylock] Mixxx ingest - refine coords against plate"
    },
    {
      "id": "pioneer-cdj-350-ch2-select_turn",
      "fig": "select_turn",
      "label": "select_turn",
      "kind": "knob",
      "x": 56.6,
      "y": 10.5,
      "w": 4.0,
      "h": 4.5,
      "layer": "base",
      "section": "other",
      "midi": {
        "name": "select_turn",
        "type": "cc",
        "ch": 1,
        "code": 79,
        "shift_name": null
      },
      "notes": "[select_turn] Mixxx ingest - refine coords against plate"
    },
    {
      "id": "pioneer-cdj-350-ch2-jog_wheel_2",
      "fig": "jog_wheel_2",
      "label": "jog_wheel",
      "kind": "jog",
      "x": 64.4,
      "y": 10.5,
      "w": 6.0,
      "h": 6.0,
      "layer": "base",
      "section": "deck",
      "midi": {
        "name": "jog_wheel_2",
        "type": "cc",
        "ch": 1,
        "code": 48,
        "shift_name": null
      },
      "notes": "[jog_wheel_2] Mixxx ingest - refine coords against plate"
    }
  ]
}
