{
  "device": "DJ-Tech DJM-101",
  "vendor": "unknown",
  "plate": {
    "image": "",
    "width": 0,
    "height": 0
  },
  "layers": [
    "base",
    "shift"
  ],
  "out_of_scope": [
    "mixxx_script_bindings",
    "hid_surfaces",
    "plate_pending"
  ],
  "controls": [
    {
      "id": "dj-tech-djm-101-head_volume",
      "fig": "head_volume",
      "label": "headVolume",
      "kind": "fader",
      "x": 2.0,
      "y": 4.0,
      "w": 3.0,
      "h": 8.0,
      "layer": "base",
      "section": "mixer",
      "midi": {
        "name": "head_volume",
        "type": "cc",
        "ch": 1,
        "code": 69,
        "shift_name": null
      },
      "notes": "[head_volume] Mixxx ingest - refine coords against plate"
    },
    {
      "id": "dj-tech-djm-101-head_mix",
      "fig": "head_mix",
      "label": "headMix",
      "kind": "knob",
      "x": 9.8,
      "y": 4.0,
      "w": 4.0,
      "h": 4.5,
      "layer": "base",
      "section": "mixer",
      "midi": {
        "name": "head_mix",
        "type": "cc",
        "ch": 1,
        "code": 68,
        "shift_name": null
      },
      "notes": "[head_mix] Mixxx ingest - refine coords against plate"
    },
    {
      "id": "dj-tech-djm-101-vumeter_select_master",
      "fig": "vumeter_select_master",
      "label": "vumeter_select_master",
      "kind": "button",
      "x": 17.6,
      "y": 4.0,
      "w": 4.0,
      "h": 4.5,
      "layer": "base",
      "section": "mixer",
      "midi": {
        "name": "vumeter_select_master",
        "type": "note",
        "ch": 1,
        "code": 36,
        "shift_name": null
      },
      "notes": "[vumeter_select_master] Mixxx ingest - refine coords against plate"
    },
    {
      "id": "dj-tech-djm-101-vumeter_select_pfl",
      "fig": "vumeter_select_pfl",
      "label": "vumeter_select_pfl",
      "kind": "button",
      "x": 25.4,
      "y": 4.0,
      "w": 4.0,
      "h": 4.5,
      "layer": "base",
      "section": "mixer",
      "midi": {
        "name": "vumeter_select_pfl",
        "type": "note",
        "ch": 1,
        "code": 35,
        "shift_name": null
      },
      "notes": "[vumeter_select_pfl] Mixxx ingest - refine coords against plate"
    },
    {
      "id": "dj-tech-djm-101-volume",
      "fig": "volume",
      "label": "volume",
      "kind": "fader",
      "x": 33.2,
      "y": 4.0,
      "w": 3.0,
      "h": 8.0,
      "layer": "base",
      "section": "mixer",
      "midi": {
        "name": "volume",
        "type": "cc",
        "ch": 1,
        "code": 67,
        "shift_name": null
      },
      "notes": "[volume] Mixxx ingest - refine coords against plate"
    },
    {
      "id": "dj-tech-djm-101-crossfader",
      "fig": "crossfader",
      "label": "crossfader",
      "kind": "fader",
      "x": 41.0,
      "y": 4.0,
      "w": 3.0,
      "h": 8.0,
      "layer": "base",
      "section": "mixer",
      "midi": {
        "name": "crossfader",
        "type": "cc",
        "ch": 1,
        "code": 64,
        "shift_name": null
      },
      "notes": "[crossfader] Mixxx ingest - refine coords against plate"
    },
    {
      "id": "dj-tech-djm-101-pregain",
      "fig": "pregain",
      "label": "pregain",
      "kind": "fader",
      "x": 48.8,
      "y": 4.0,
      "w": 3.0,
      "h": 8.0,
      "layer": "base",
      "section": "deck",
      "midi": {
        "name": "pregain",
        "type": "cc",
        "ch": 1,
        "code": 72,
        "shift_name": null
      },
      "notes": "[pregain] Mixxx ingest - refine coords against plate"
    },
    {
      "id": "dj-tech-djm-101-volume_2",
      "fig": "volume_2",
      "label": "volume",
      "kind": "fader",
      "x": 56.6,
      "y": 4.0,
      "w": 3.0,
      "h": 8.0,
      "layer": "base",
      "section": "deck",
      "midi": {
        "name": "volume_2",
        "type": "cc",
        "ch": 1,
        "code": 65,
        "shift_name": null
      },
      "notes": "[volume_2] Mixxx ingest - refine coords against plate"
    },
    {
      "id": "dj-tech-djm-101-pfl",
      "fig": "pfl",
      "label": "pfl",
      "kind": "button",
      "x": 64.4,
      "y": 4.0,
      "w": 4.0,
      "h": 4.5,
      "layer": "base",
      "section": "deck",
      "midi": {
        "name": "pfl",
        "type": "note",
        "ch": 1,
        "code": 33,
        "shift_name": null
      },
      "notes": "[pfl] Mixxx ingest - refine coords against plate"
    },
    {
      "id": "dj-tech-djm-101-filter_high",
      "fig": "filter_high",
      "label": "filterHigh",
      "kind": "knob",
      "x": 72.2,
      "y": 4.0,
      "w": 4.0,
      "h": 4.5,
      "layer": "base",
      "section": "deck",
      "midi": {
        "name": "filter_high",
        "type": "cc",
        "ch": 1,
        "code": 74,
        "shift_name": null
      },
      "notes": "[filter_high] Mixxx ingest - refine coords against plate"
    },
    {
      "id": "dj-tech-djm-101-filter_mid",
      "fig": "filter_mid",
      "label": "filterMid",
      "kind": "knob",
      "x": 80.0,
      "y": 4.0,
      "w": 4.0,
      "h": 4.5,
      "layer": "base",
      "section": "deck",
      "midi": {
        "name": "filter_mid",
        "type": "cc",
        "ch": 1,
        "code": 78,
        "shift_name": null
      },
      "notes": "[filter_mid] Mixxx ingest - refine coords against plate"
    },
    {
      "id": "dj-tech-djm-101-filter_low",
      "fig": "filter_low",
      "label": "filterLow",
      "kind": "knob",
      "x": 87.8,
      "y": 4.0,
      "w": 4.0,
      "h": 4.5,
      "layer": "base",
      "section": "deck",
      "midi": {
        "name": "filter_low",
        "type": "cc",
        "ch": 1,
        "code": 76,
        "shift_name": null
      },
      "notes": "[filter_low] Mixxx ingest - refine coords against plate"
    },
    {
      "id": "dj-tech-djm-101-pregain_2",
      "fig": "pregain_2",
      "label": "pregain",
      "kind": "fader",
      "x": 2.0,
      "y": 10.5,
      "w": 3.0,
      "h": 8.0,
      "layer": "base",
      "section": "deck",
      "midi": {
        "name": "pregain_2",
        "type": "cc",
        "ch": 1,
        "code": 79,
        "shift_name": null
      },
      "notes": "[pregain_2] Mixxx ingest - refine coords against plate"
    },
    {
      "id": "dj-tech-djm-101-volume_3",
      "fig": "volume_3",
      "label": "volume",
      "kind": "fader",
      "x": 9.8,
      "y": 10.5,
      "w": 3.0,
      "h": 8.0,
      "layer": "base",
      "section": "deck",
      "midi": {
        "name": "volume_3",
        "type": "cc",
        "ch": 1,
        "code": 66,
        "shift_name": null
      },
      "notes": "[volume_3] Mixxx ingest - refine coords against plate"
    },
    {
      "id": "dj-tech-djm-101-pfl_2",
      "fig": "pfl_2",
      "label": "pfl",
      "kind": "button",
      "x": 17.6,
      "y": 10.5,
      "w": 4.0,
      "h": 4.5,
      "layer": "base",
      "section": "deck",
      "midi": {
        "name": "pfl_2",
        "type": "note",
        "ch": 1,
        "code": 34,
        "shift_name": null
      },
      "notes": "[pfl_2] Mixxx ingest - refine coords against plate"
    },
    {
      "id": "dj-tech-djm-101-filter_high_2",
      "fig": "filter_high_2",
      "label": "filterHigh",
      "kind": "knob",
      "x": 25.4,
      "y": 10.5,
      "w": 4.0,
      "h": 4.5,
      "layer": "base",
      "section": "deck",
      "midi": {
        "name": "filter_high_2",
        "type": "cc",
        "ch": 1,
        "code": 77,
        "shift_name": null
      },
      "notes": "[filter_high_2] Mixxx ingest - refine coords against plate"
    },
    {
      "id": "dj-tech-djm-101-filter_mid_2",
      "fig": "filter_mid_2",
      "label": "filterMid",
      "kind": "knob",
      "x": 33.2,
      "y": 10.5,
      "w": 4.0,
      "h": 4.5,
      "layer": "base",
      "section": "deck",
      "midi": {
        "name": "filter_mid_2",
        "type": "cc",
        "ch": 1,
        "code": 75,
        "shift_name": null
      },
      "notes": "[filter_mid_2] Mixxx ingest - refine coords against plate"
    },
    {
      "id": "dj-tech-djm-101-filter_low_2",
      "fig": "filter_low_2",
      "label": "filterLow",
      "kind": "knob",
      "x": 41.0,
      "y": 10.5,
      "w": 4.0,
      "h": 4.5,
      "layer": "base",
      "section": "deck",
      "midi": {
        "name": "filter_low_2",
        "type": "cc",
        "ch": 1,
        "code": 73,
        "shift_name": null
      },
      "notes": "[filter_low_2] Mixxx ingest - refine coords against plate"
    }
  ]
}
